{
  "title": "GEE: Count Outcomes",
  "metadata": {
    "method_family": "GEE",
    "method_family_label": "Generalized Estimating Equations (GEE)",
    "statistical_engine": "geepack",
    "engines": [
      "geepack"
    ],
    "covariates": "TIC",
    "outcome_type": "Count",
    "updated_at": "2026-02-26",
    "tags": [
      "abcd-study",
      "gee",
      "marginal-model",
      "count-data"
    ],
    "author": "Biostatistics Working Group",
    "description": "Fit population-averaged GEE models for count outcomes, compare Poisson and quasi-Poisson specifications, detect overdispersion, and interpret rate ratios for repeated-measures ABCD data.",
    "summary": "Fit population-averaged GEE models for count outcomes, compare Poisson and quasi-Poisson specifications, detect overdispersion, and interpret rate ratios for repeated-measures ABCD data.",
    "difficulty": "intermediate",
    "timepoints": "3_5"
  },
  "overview": {
    "summary": "Generalized Estimating Equations for count outcomes extend the GEE framework from binary to Poisson-family responses, modeling how the rate of events changes over time at the population level while accounting for within-subject correlation. Count outcomes — such as days of substance use, number of behavioral incidents, or frequency of health-related events — are common in longitudinal developmental research but violate the assumptions of standard linear models. This tutorial applies Poisson GEE to analyze alcohol use days in the past 30 days among ABCD youth across annual assessments, demonstrating overdispersion detection, robust standard error estimation, and interpretation of incidence rate ratios.",
    "features_panel": {
      "title": "Features",
      "items": [
        {
          "heading": "When to Use:",
          "text": "Apply when your outcome is a non-negative integer count measured repeatedly and you want population-averaged trends while accounting for within-subject correlation."
        },
        {
          "heading": "Key Advantage:",
          "text": "GEE with Poisson or quasi-Poisson family provides valid marginal rate ratio estimates even when the variance-mean relationship is misspecified, as long as the mean model is correct and robust standard errors are used."
        },
        {
          "heading": "What You'll Learn:",
          "text": "How to fit Poisson GEE, detect and handle overdispersion, compare robust versus naive standard errors, and interpret incidence rate ratios for count outcomes."
        }
      ]
    }
  },
  "data_access": {
    "items": [
      {
        "type": "collapsible",
        "title": "Data Download",
        "content": "<p>ABCD data can be accessed through the <a href=\"https://nbdc.deapscience.com\">DEAP platform</a> or the <a href=\"https://nbdc-datashare.lassoinformatics.com\">NBDC Data Access Platform (LASSO)</a>, which provide user-friendly interfaces for creating custom datasets with point-and-click variable selection. For detailed instructions on accessing and downloading ABCD data, see the <a href=\"https://docs.deapscience.com\">DEAP documentation</a>.</p>\n",
        "open": false
      },
      {
        "type": "collapsible",
        "title": "Loading Data with NBDCtools",
        "content": "<p>Once you have downloaded ABCD data files, the <a href=\"https://software.nbdc-datahub.org/NBDCtools/\"><strong>NBDCtools</strong></a> package provides efficient tools for loading and preparing your data for analysis. The package handles common data management tasks including:</p>\n<ul>\n<li><strong>Automatic data joining</strong> - Merges variables from multiple tables automatically</li>\n<li><strong>Built-in transformations</strong> - Converts categorical variables to factors, handles missing data codes, and adds variable labels</li>\n<li><strong>Event filtering</strong> - Easily selects specific assessment waves</li>\n</ul>\n<p>For more information, visit the <a href=\"https://software.nbdc-datahub.org/NBDCtools/\">NBDCtools documentation</a>.</p>\n",
        "open": false
      },
      {
        "type": "collapsible",
        "title": "Basic Usage",
        "content": "<p>The <code>create_dataset()</code> function is the main tool for loading ABCD data:</p>\n<pre><code class=\"language-r\"><span class=\"syn-string\">library</span><span class=\"syn-function\">(</span><span class=\"syn-function\">NBDCtools</span><span class=\"syn-function\">)</span><span class=\"syn-function\">\n</span><span class=\"syn-function\">\n</span><span class=\"syn-comment\">#</span><span class=\"syn-comment\"> Define variables needed for this analysis\n</span><span class=\"syn-function\">requested_vars </span><span class=\"syn-function\">&lt;-</span><span class=\"syn-function\"> </span><span class=\"syn-string\">c</span><span class=\"syn-function\">(</span><span class=\"syn-function\">\n</span><span class=\"syn-function\">  </span><span class=\"syn-function\">&quot;</span><span class=\"syn-string\">var_1</span><span class=\"syn-function\">&quot;</span><span class=\"syn-function\">,</span><span class=\"syn-function\">   </span><span class=\"syn-comment\">#</span><span class=\"syn-comment\"> Variable 1\n</span><span class=\"syn-function\">  </span><span class=\"syn-function\">&quot;</span><span class=\"syn-string\">var_2</span><span class=\"syn-function\">&quot;</span><span class=\"syn-function\">,</span><span class=\"syn-function\">   </span><span class=\"syn-comment\">#</span><span class=\"syn-comment\"> Variable 2\n</span><span class=\"syn-function\">  </span><span class=\"syn-function\">&quot;</span><span class=\"syn-string\">var_3</span><span class=\"syn-function\">&quot;</span><span class=\"syn-function\">    </span><span class=\"syn-comment\">#</span><span class=\"syn-comment\"> Variable 3\n</span><span class=\"syn-function\">)</span><span class=\"syn-function\">\n</span><span class=\"syn-function\">\n</span><span class=\"syn-comment\">#</span><span class=\"syn-comment\"> Set path to downloaded ABCD data files\n</span><span class=\"syn-function\">data_dir </span><span class=\"syn-function\">&lt;-</span><span class=\"syn-function\"> </span><span class=\"syn-string\">Sys.getenv</span><span class=\"syn-function\">(</span><span class=\"syn-function\">&quot;</span><span class=\"syn-string\">ABCD_DATA_PATH</span><span class=\"syn-function\">&quot;</span><span class=\"syn-function\">,</span><span class=\"syn-function\"> </span><span class=\"syn-function\">&quot;</span><span class=\"syn-string\">/path/to/abcd/6_0/phenotype</span><span class=\"syn-function\">&quot;</span><span class=\"syn-function\">)</span><span class=\"syn-function\">\n</span><span class=\"syn-function\">\n</span><span class=\"syn-comment\">#</span><span class=\"syn-comment\"> Load data with automatic transformations\n</span><span class=\"syn-function\">abcd_data </span><span class=\"syn-function\">&lt;-</span><span class=\"syn-function\"> </span><span class=\"syn-function\">create_dataset</span><span class=\"syn-function\">(</span><span class=\"syn-function\">\n</span><span class=\"syn-function\">  </span><span class=\"syn-number\">dir_data</span><span class=\"syn-function\"> </span><span class=\"syn-function\">=</span><span class=\"syn-function\"> data_dir</span><span class=\"syn-function\">,</span><span class=\"syn-function\">\n</span><span class=\"syn-function\">  </span><span class=\"syn-number\">study</span><span class=\"syn-function\"> </span><span class=\"syn-function\">=</span><span class=\"syn-function\"> </span><span class=\"syn-function\">&quot;</span><span class=\"syn-string\">abcd</span><span class=\"syn-function\">&quot;</span><span class=\"syn-function\">,</span><span class=\"syn-function\">\n</span><span class=\"syn-function\">  </span><span class=\"syn-number\">vars</span><span class=\"syn-function\"> </span><span class=\"syn-function\">=</span><span class=\"syn-function\"> requested_vars</span><span class=\"syn-function\">,</span><span class=\"syn-function\">\n</span><span class=\"syn-function\">  </span><span class=\"syn-number\">release</span><span class=\"syn-function\"> </span><span class=\"syn-function\">=</span><span class=\"syn-function\"> </span><span class=\"syn-function\">&quot;</span><span class=\"syn-string\">6.0</span><span class=\"syn-function\">&quot;</span><span class=\"syn-function\">,</span><span class=\"syn-function\">\n</span><span class=\"syn-function\">  </span><span class=\"syn-number\">format</span><span class=\"syn-function\"> </span><span class=\"syn-function\">=</span><span class=\"syn-function\"> </span><span class=\"syn-function\">&quot;</span><span class=\"syn-string\">parquet</span><span class=\"syn-function\">&quot;</span><span class=\"syn-function\">,</span><span class=\"syn-function\">\n</span><span class=\"syn-function\">  </span><span class=\"syn-number\">categ_to_factor</span><span class=\"syn-function\"> </span><span class=\"syn-function\">=</span><span class=\"syn-function\"> </span><span class=\"syn-number\">TRUE</span><span class=\"syn-function\">,</span><span class=\"syn-function\">   </span><span class=\"syn-comment\">#</span><span class=\"syn-comment\"> Convert categorical variables to factors\n</span><span class=\"syn-function\">  </span><span class=\"syn-number\">value_to_na</span><span class=\"syn-function\"> </span><span class=\"syn-function\">=</span><span class=\"syn-function\"> </span><span class=\"syn-number\">TRUE</span><span class=\"syn-function\">,</span><span class=\"syn-function\">        </span><span class=\"syn-comment\">#</span><span class=\"syn-comment\"> Convert missing codes (222, 333, etc.) to NA\n</span><span class=\"syn-function\">  </span><span class=\"syn-number\">add_labels</span><span class=\"syn-function\"> </span><span class=\"syn-function\">=</span><span class=\"syn-function\"> </span><span class=\"syn-number\">TRUE</span><span class=\"syn-function\">          </span><span class=\"syn-comment\">#</span><span class=\"syn-comment\"> Add variable and value labels\n</span